Region,District,HF,Expected reports,Actual reports,dropout rate,DPT3,PCV 3,wastage rate
Kigezi,Kisoro District,Kisoro Community Medica Centre,,,,,,
Kigezi,Kisoro District,Kisoro General Hospital,1,1,-28,64,64,-13.5
Kigezi,Kisoro District,Kisoro Kagunga Health Centre II,1,1,-133,7,7,57.6
Kigezi,Kisoro District,Kisoro Police Health Centre II,1,1,,,,
Kigezi,Kisoro District,Kisoro Prisons Health Centre II,1,1,,,,
Busoga,Namutumba District,Kisowozi Health Centre II,1,1,-14,16,16,
North Central,Buikwe District,Kisozi Dental & Medical Clinic,,,,,,
Busoga,Kamuli District,Kisozi Flep Health Centre III,1,1,18,36,36,10
Busoga,Kamuli District,Kisozi Health Centre II,,,,,,
South Central,Gomba District,Kisozi Health Centre III,1,1,-6,50,50,-71.7
Tooro,Bundibugyo District,Kisuba Health Centre III,1,1,18,18,18,31.3
South Central,Wakiso District,Kisubi Hospital,1,0,8,264,261,440
Kampala,Kampala District,Kisugu Health Centre III,1,1,18,96,96,0
Kampala,Kampala District,Kiswa Health Centre III,1,1,-46,67,65,5.8
South Central,Masaka City,Kitabaazi Health Centre III,1,1,0,32,32,
Ankole,Sheema District,Kitagata General Hospital,1,1,37,12,12,
Tooro,Kitagwenda District,Kitagwenda Medical Centre,1,1,,,,
Bunyoro,Kakumiro District,Kitaihuka Health Centre III,1,1,18,56,60,
Kampala,Kampala District,Kitaka Medical Centre,,,,,,
South Central,Wakiso District,Kitala Health Centre II,1,1,-2,55,52,30.7
South Central,Wakiso District,Kitala Prisons Health Centre II,1,1,,,,
South Central,Wakiso District,Kitalya Min Max Health Centre III,1,1,,0,0,
South Central,Wakiso District,Kitalya Prisons Health Centre II,1,1,,,,
Bunyoro,Hoima District,Kitana Health Centre II,1,1,,,,100
Busoga,Jinja District,Kitanaba Health Centre II,1,1,,5,5,7.7
South Central,Bukomansimbi District,Kitanda Health Centre III,1,1,23,30,30,
South Central,Bukomansimbi District,Kitanda Prisons Health Centre II,1,1,,,,
Kigezi,Rukiga District,Kitanga Health Centre II,1,1,11,8,8,19.4
Kigezi,Rukiga District,Kitanga Hilbe Health Centre III,1,1,-50,21,21,3.8
Kampala,Kampala District,Kitante Medical Centre,1,1,-100,20,24,0
Bunyoro,Masindi District,Kitanyata Health Centre II,1,1,45,17,17,12.2
Kigezi,Kanungu District,Kitariro Health Centre II,1,1,38,5,6,5
Busoga,Kamuli District,Kitayunjwa Health Centre III,1,1,,,,
Kampala,Kampala District,Kitebi Health Centre III,1,1,9,374,325,9.7
Kampala,Kampala District,Kitebi Medical Centre,1,1,-13,17,17,
Bunyoro,Kagadi District,Kitemba Medical Centre,,,,,,
Tooro,Kyenjojo District,Kitembe Health Centre II,1,1,,,,
South Central,Wakiso District,Kitemu Medical Health Centre II,1,1,,,,
North Central,Mubende District,Kitenga Health Centre III,1,1,58,30,30,13.3
North Central,Mityana District,Kiteredde Health Centre II,1,1,50,9,9,-14.7
Acholi,Kitgum District,Kitgum General Hospital,1,1,48,28,28,8.4
Acholi,Kitgum District,Kitgum Maternity and Medical Centre,1,1,,,,
Acholi,Kitgum District,Kitgum Police Health Centre II,1,1,,,,
Acholi,Kitgum District,Kitgum Prisons Health Centre II,1,1,,,,
Acholi,Kitgum District,Kitgum Youth Centre Clinic,1,1,,,,
Acholi,Kitgum District,Kitgum-Matidi Health Centre III,1,1,-21,34,34,-30.6
Tooro,Kasese District,Kitholhu Health Centre III,1,1,-58,19,14,-4
South Central,Kalungu District,Kiti Health Centre III,1,1,30,28,28,25.7
South Central,Wakiso District,Kitibwa Medical Clinic,,,,,,
Kigezi,Rukungiri District,Kitimba Health Centre III,1,1,-175,11,11,-425
South Central,Butambala District,Kitimba Health Centre III,1,1,-15,23,23,-100
Kampala,Kampala District,Kitintale Health Clinic,,,,,,
Kampala,Kampala District,Kitintale Hospital,1,1,-133,14,14,-65
Busoga,Bugiri District,Kitodha Health Centre II,1,1,23,20,20,
Ankole,Rwampara District,Kitojo (Bugamba) Health Centre II,1,1,60,4,4,33.3
Kigezi,Rukiga District,Kitojo (Rwamucucu) Health Centre II,1,1,38,8,8,74.4
Ankole,Sheema District,Kitojo (Sheema) Health Centre III,1,1,-60,16,16,25
Kigezi,Rukungiri District,Kitojo Ngo Health Centre II,1,1,-20,6,6,
North Central,Kassanda District,Kitokolo Health Centre II,1,1,56,18,13,1.1
Ankole,Ntungamo District,Kitondo Health Centre III,1,1,4,50,50,1.3
North Central,Mityana District,Kitongo Health Centre III,1,1,-64,18,16,
Bunyoro,Kikuube District,Kitoole Health Centre II,1,1,-4,28,28,50.6
Kigezi,Kabale District,Kitooma Health Centre III,1,1,-100,18,18,18.4
South Central,Wakiso District,Kitooro Health Centre III,1,1,,,,
South Central,Lwengo District,Kitooro Luyembe Health Centre III,,,,,,
Busoga,Mayuge District,Kitovu Health Centre II,1,1,8,66,67,-182.9
South Central,Masaka City,Kitovu Hospital,1,1,7,40,40,14.3
South Central,Masaka City,Kitovu Mobile Clinic,1,1,80,2,2,10
Tooro,Kasese District,Kitswamba Health Centre III,1,1,-2,41,41,65.8
Tooro,Kabarole District,Kitule Health Centre III,1,1,5,38,38,
Busoga,Bugiri District,Kitumba Health Centre II,1,1,-10,33,33,4.5
West Nile,Nebbi District,Kituna Health Centre II,1,1,46,20,20,-15.7
Kigezi,Rukiga District,Kitunga (Kashambya) Health Centre II,1,1,0,12,12,52
South Central,Masaka District,Kitunga Kyanamukaaka Health Centre II,1,1,27,22,22,50.4
South Central,Mpigi District,Kituntu Health Centre III,1,1,7,26,21,-50
Ankole,Kiruhura District,Kitura Health Centre III,1,1,4,65,43,-44.2
North Central,Mubende District,Kituule Health Centre II,1,1,15,40,40,-0.79
Bunyoro,Kiryandongo District,Kitwara Health Centre II,1,1,-93,54,25,-35
South Central,Gomba District,Kitwe Health Centre II,1,1,-20,12,12,73
Ankole,Ntungamo District,Kitwe Health Centre IV,1,1,1,90,90,9.3
South Central,Gomba District,Kitwe Prisons Health Centre II,1,1,,,,
Busoga,Mayuge District,Kityerera Health Centre IV,1,1,16,69,69,
Busoga,Mayuge District,Kityerera Prisons Clinic,1,1,,,,
Ankole,Bushenyi District,KIU Teaching Hospital,1,1,4,26,26,16
Kampala,Kampala District,Kiwabo Medical Care Centre,1,1,,,,
North Central,Mukono District,Kiwaga Health Centre II,,,,,,
Busoga,Luuka District,Kiwalazi Health Centre II,1,1,-31,17,17,16.7
North Central,Nakasongola District,Kiwambya Health Centre II (Nakasongola),1,1,18,9,9,-250
North Central,Mukono District,Kiwanga Health Centre II,1,1,,,,
South Central,Lwengo District,Kiwangala Health Centre IV,1,1,82,22,22,
Busoga,Iganga District,Kiwanyi Health Centre II,1,1,6,16,16,-2
Kampala,Kampala District,Kiwatule Clinic,,,,,,
Kampala,Kampala District,Kiwatule Medical Centre,1,1,,,,
South Central,Kalungu District,Kiwawo Muslim Health Centre II,1,1,,,,
Kampala,Kampala District,Kiwenda Dental,,,,,,
North Central,Nakaseke District,Kiwoko Hospital,1,1,25,63,63,28.8
North Central,Mukono District,Kiwumu CoU Health Centre,1,1,,,,
Kampala,Kampala District,Kiwumulo Clinic,1,0,,,,
Kampala,Kampala District,Kiwumulo Medical Clinic,1,1,,,,
Tooro,Kamwenge District,Kiyagara Health Centre III,1,1,-118,72,72,65.4
Ankole,Buhweju District,Kiyanja Health Centre III,1,1,-50,27,27,30
Kigezi,Rubanda District,Kiyebe Health Centre II,1,1,-22,11,11,16.7
Bukedi,Tororo District,Kiyeyi Health Centre III,1,1,-48,46,46,16.3
South Central,Lyantonde District,Kiyinda Health Centre II,1,1,25,3,3,-60
North Central,Mubende District,Kiyita Health Centre II,1,1,-44,13,12,-3.3
North Central,Mityana District,Kiyoganyi Health Centre II,1,1,-11,10,10,112.6
Tooro,Bunyangabu District,Kiyombya Health Centre III,1,1,-13,35,35,27.3
North Central,Mukono District,Kiyoola Health Centre II,1,1,57,10,10,-15.8
Ankole,Ntungamo District,Kiyoora Health Centre II,1,1,-33,12,12,57.1
South Central,Masaka City,Kiyumba Health Centre IV,1,1,-47,59,59,-15.3
Busoga,Kamuli District,Kiyunga Bukakande Health Centre II,1,1,-35,35,36,10
Busoga,Kamuli District,Kiyunga Health Centre III,,,-6,36,36,10
Busoga,Luuka District,Kiyunga Health Centre IV,1,1,-13,110,123,4.7
Busoga,Luuka District,Kiyunga Prisons Health Centre II,1,1,,,,
North Central,Mubende District,Kiyuni (Mubende) Health Centre III,1,1,28,54,54,4.1
North Central,Kyankwanzi District,Kiyuni Health Centre III,1,1,10,35,43,1
Ankole,Sheema District,Kiziba (Kagango) Health Centre II,1,1,36,9,9,40
Tooro,Kamwenge District,Kiziba (Kamwenge) Health Centre II,1,1,-76,30,30,17.8
South Central,Wakiso District,Kiziba Catholic/Kiziba St. Ulrika Health Centre III,1,1,42,15,15,73
South Central,Wakiso District,Kiziba Health Centre III,1,1,28,23,23,-210.3
North Central,Buikwe District,Kizigo Health Centre II,1,1,-3,32,32,
South Central,Butambala District,Kiziiko Health Centre II,1,1,-8,13,13,7.5
Kampala,Kampala District,Kizito Family Care Doctors,,,,,,
South Central,Wakiso District,Kjk Health Centre II,,,,,,
Kampala,Kampala District,Kk Clinic,,,,,,
South Central,Mpigi District,KK Medical Centre,1,1,57,10,10,
Kampala,Kampala District,Kk Medical Centre (Bwaise I),,,,,,
Kampala,Kampala District,KK Mubeezi Dental Clinic,,,,,,
Bunyoro,Kakumiro District,Kkcbo Health Centre II,,,,,,
South Central,Mpigi District,Kkonge St. Luke Health Centre III,1,1,-17,7,7,12.5
Bukedi,Tororo District,Klinics Of St. Francis Clinic,1,1,,,,
Kigezi,Kabale District,KMC Clinic HC II,1,1,33,12,12,14
Kampala,Kampala District,Kmj Medical Centre,1,0,,,,
Kampala,Kampala District,Kms Clinic Namungoona,1,0,,,,
West Nile,Koboko District,Koboko Army Barracks Health Centre II,1,1,,,,
West Nile,Koboko District,Koboko General Hospital,1,1,7,223,223,-22.8
West Nile,Koboko District,Koboko Hope of Glory Medical Centre,1,1,,,,
West Nile,Koboko District,Koboko Medical Centre,1,1,,0,0,
West Nile,Koboko District,Koboko Mission Health Centre III,1,1,5,39,39,2.4
West Nile,Koboko District,Koboko Police Barracks Health Centre II,1,1,,,,
West Nile,Koboko District,Koboko Prisons Health Centre II,1,1,,,,
Teso,Bukedea District,Koboli Health Centre II,1,1,,,,
Teso,Kaberamaido District,Kobulubulu Health Centre III,1,1,33,34,34,30.4
Teso,Ngora District,Kobwin Health Centre III,1,1,10,38,38,-150
Acholi,Nwoya District,Koch Goma Health Centre III,1,1,15,144,144,
West Nile,Nebbi District,Koch Health Centre II,1,1,-17,14,14,5
Acholi,Nwoya District,Koch Lii Health Centre III,1,1,25,56,55,-4.1
Teso,Bukedea District,Kocheka Health Centre III,1,1,4,48,48,-47
West Nile,Yumbe District,Kochi Health Centre III,1,0,7,41,40,4.6
Karamoja,Karenga District,Kocholo Health Centre II,1,1,5,18,18,20.3
Karamoja,Moroto District,Kodonyo Health Centre II,1,1,-100,8,8,48.4
North Central,Mukono District,Kojja Health Centre IV,1,1,20,96,98,
Acholi,Agago District,Kokil Health Centre II,1,1,0,16,16,-17.5
Teso,Katakwi District,Kokorio Health Centre II,1,1,-14,8,8,36.7
Bugisu,Kapchorwa District,Kokwomurya Health Centre II,1,1,-8,27,27,-38.3
Lango,Kole District,Kole Prisons Health Centre II,1,1,,,,
Teso,Bukedea District,Kolir Health Centre III,1,1,-40,108,108,30.6
Kampala,Kampala District,Kololo Hospital,1,1,,,,
Bugisu,Mbale City,Kolonyi Health Centre IV,1,1,-21,64,64,-441.7
Kampala,Kampala District,Komamboga Health Centre III,1,1,-28,280,173,-76.5
West Nile,Yumbe District,Komgbe Health Centre III,1,1,-15,15,15,
Kampala,Kampala District,Komuka Clinic,,,,,,
Teso,Amuria District,Kona Clinic Amuria,1,1,,,,
Ankole,Rwampara District,Kongoro Health Centre II,1,1,55,5,5,
Bugisu,Kween District,Kongta Health Centre II,1,1,12,15,15,-40
North Central,Buikwe District,Konko Health Centre II,1,1,-12,9,9,
Acholi,Gulu City,Kony-Kwo Clinic,,,,,,
North Central,Mukono District,Koome Health Centre III,1,1,36,14,14,-27.3
North Central,Mukono District,Koome Prisons Health Centre II,1,1,,,,
Karamoja,Kaabong District,Kopoth Health Centre III,1,1,10,19,19,0
Teso,Katakwi District,Koritok Health Centre II,1,1,-8,39,39,19.2
Acholi,Omoro District,Koro Abili Health Centre II,1,1,40,12,12,-54.2
West Nile,Yumbe District,Koro Health Centre III,1,1,10,9,9,
Bugisu,Bukwo District,Kortek Health Centre III,1,1,-145,27,20,51.5
Karamoja,Amudat District,Kosike Health Centre III,1,1,-83,11,11,0
Karamoja,Moroto District,Kosiroi Health Centre II,1,1,-300,4,4,-50
Karamoja,Kotido District,Kotido General Hospital,1,1,,,,
Karamoja,Kotido District,Kotido Police Health Centre II,1,1,,,,
Karamoja,Kotido District,Kotido Prisons Health Centre II,1,1,,,,
Acholi,Agago District,Kotomor Health Centre III,1,1,1,95,95,-132.5
Karamoja,Abim District,Koya Health Centre II,1,1,-40,21,21,-633.3
Kampala,Kampala District,KPS Medical Clinic,,,,,,
Kampala,Kampala District,KR Clinic,,,,,,
Kampala,Kampala District,Kriste Olaf Clinic & Wellness,1,0,,,,
Lango,Otuke District,Kristina Health Centre III,1,1,17,5,5,15
West Nile,Adjumani District,Kristo Medical and Diagnostic Centre Adjumani,1,1,,,,
Kampala,Kampala District,KSB Medical Centre,,,,,,
Bukedi,Busia District,Kubo Health Centre II,1,1,0,19,19,-12
West Nile,Nebbi District,Kucwiny Health Centre III,1,1,14,36,36,9.2
South Central,Wakiso District,Kugumikiriza Domicilliary Clinic,,,,,,
North Central,Buikwe District,Kulabako Moscow Clinic,,,,,,
West Nile,Yumbe District,Kulikulinga Health Centre III,1,1,7,94,101,-3.3
West Nile,Koboko District,Kuluba Health Centre III,1,1,50,38,38,-20.8
West Nile,Arua District,Kuluva Hospital,1,1,13,90,90,-7.7
Teso,Kumi District,Kumi (Ongino) Hospital,1,1,13,27,27,514.3
Teso,Kumi District,Kumi Community and Imaging Health Centre II,,,,,,
Teso,Kumi District,Kumi Health Centre IV,1,1,-24,180,180,-5.5
Teso,Kumi District,Kumi Orthopaedic Centre Hospital,1,1,,,,
Teso,Kumi District,Kumi Police Health Centre II,1,1,,,,
Teso,Kumi District,Kumi Prisons Health Centre II,1,1,,,,
Teso,Kumi District,Kumi University Clinic,1,1,,,,
West Nile,Terego District,Kumuyo Health Centre II,1,1,-14,42,42,-5
Lango,Apac District,Kungu Health Centre III,1,1,-38,36,36,7.8
West Nile,Adjumani District,Kureku Health Centre II,1,1,-29,18,18,-12
West Nile,Yumbe District,Kuru Medical Clinic,1,0,,,,
South Central,Kyotera District,Kuteesa Clinic,,,,,,
South Central,Lyantonde District,Kuteesa Drug Shop,,,,,,
South Central,Wakiso District,Kuteesa General Clinic,1,1,0,19,19,3.3
Acholi,Agago District,Kuywee Health Centre II,1,1,-29,27,27,-300
Kampala,Kampala District,Kv Medical Clinic,1,0,,,,
South Central,Wakiso District,Kwagala Care Clinic,,,,,,
South Central,Wakiso District,Kwagala Doctor Clinic,,,,,,
North Central,Mubende District,Kwagala Medical Centre (Mubende),,,,,,
South Central,Wakiso District,Kwagala Medical Centre (Wakiso),,,,,,
South Central,Wakiso District,Kwagala Medical Clinic (Mende),1,0,,,,
South Central,Lyantonde District,Kwagara Drug Shop,,,,,,
South Central,Wakiso District,Kwam Medicare Health Centre II,,,,,,
Lango,Kwania District,Kwania Prisons Health Centre II,1,1,,0,0,
Bugisu,Kween District,Kwanyiy Health Centre III,1,1,4,26,26,-290
Bukedi,Tororo District,Kwapa Family Clinic,1,1,,,,
Bukedi,Tororo District,Kwapa Health Centre III,1,1,-25,60,60,-10.6
Lango,Dokolo District,Kwera Community Maternity Home Clinic,,,,,,
Lango,Dokolo District,Kwera Health Centre III,1,1,9,41,41,21.3
West Nile,Moyo District,Kweyo Health Centre II,1,1,8,11,11,0
Bugisu,Bukwo District,Kwirwot Health Centre III,1,1,33,18,18,-54
Acholi,Agago District,Kwonkic Health Centre II,1,1,-133,28,28,-116.7
Bugisu,Kween District,Kworus Health Centre II,1,1,30,14,14,25.7
Bugisu,Kapchorwa District,Kwoti Health Centre II,1,1,36,9,9,-10.7
South Central,Butambala District,Kyabadaza Health Centre III,1,1,57,10,11,49.1
Ankole,Isingiro District,Kyabahesi Health Centre II,1,1,-39,25,25,-63.2
Ankole,Rubirizi District,Kyabakara Health Centre III,1,1,-22,33,33,-95
South Central,Masaka City,Kyabakuza Health Centre II,1,1,31,20,20,12.6
North Central,Mukono District,Kyabalogo Health Centre II,1,1,-114,15,15,-40
Ankole,Sheema District,Kyabandara Health Centre II,1,1,-45,16,16,8.9
Bunyoro,Kakumiro District,Kyabasaija Health Centre III,1,1,31,43,43,11.8
Bunyoro,Kagadi District,Kyabasara Health Centre III,1,1,4,52,52,4.2
Bunyoro,Hoima District,Kyabasengya Health Centre II,1,1,-11,21,21,23.8
North Central,Mukono District,Kyabazaala Health Centre III,1,1,8,37,37,-75.4
Tooro,Kamwenge District,Kyabenda Health Centre III,1,1,0,43,43,23.8
South Central,Sembabule District,Kyabi Health Centre III,1,1,13,65,65,1.9
South Central,Rakai District,Kyabigondo Health Centre II,1,1,38,39,39,361.1
Tooro,Kasese District,Kyabikere Health Centre II,1,1,0,1,3,70
Ankole,Isingiro District,Kyabinunga Health Centre II,1,1,22,18,18,35
Ankole,Isingiro District,Kyabirukwa Health Centre III,1,1,14,25,25,22
Ankole,Bushenyi District,Kyabugimbi Health Centre IV,1,1,1,67,67,63.1
Kigezi,Rukungiri District,Kyaburere Health Centre II,1,1,17,10,10,
Kampala,Kampala District,Kyadondo Medical Centre,1,1,-3,33,34,41.1
Ankole,Ntungamo District,Kyafoora Health Centre II,1,1,-43,10,10,56.7
Bunyoro,Kagadi District,Kyakabadma Health Centre III,1,1,11,32,28,45
South Central,Kyotera District,Kyakanyomozi Health Centre II,1,1,-33,20,20,-83.3
Bunyoro,Hoima City,Kyakapeya Health Centre II,1,1,29,17,17,48.8
Tooro,Kamwenge District,Kyakarafa Health Centre II,1,1,30,7,7,40
North Central,Mubende District,Kyakasa Health Centre II,1,1,50,23,4,32.3
Bunyoro,Kibaale District,Kyakasengura Prisons Health Centre II,1,1,,,,
Tooro,Kyenjojo District,Kyakatara Health Centre III,1,1,-12,28,28,12.2
South Central,Bukomansimbi District,Kyakatebe Community Health Centre II,1,1,-40,14,14,0
North Central,Kassanda District,Kyakatebe Health Centre II,1,1,24,32,32,5
North Central,Kassanda District,Kyakiddu Health Centre II,1,1,-3,30,30,3.3
South Central,Kyotera District,Kyakonda Health Centre II,1,1,-18,20,20,
South Central,Lyantonde District,Kyakuterekera Health Centre II,1,1,-25,5,5,
Bunyoro,Kakumiro District,Kyakuterekera Health Centre III,1,1,25,3,3,
Kampala,Kampala District,Kyakuwa Clinic (Bukasa),,,,,,
Kampala,Kampala District,Kyakuwa Clinic (Kibuye I),,,,,,
South Central,Kyotera District,Kyakuwa Medical Centre,1,1,,,,
North Central,Luwero District,Kyalugondo Health Centre III,1,1,-11,80,80,-268.3
South Central,Rakai District,Kyalulangira Health Centre III,1,1,-14,33,33,25
South Central,Lwengo District,Kyamaganda Health Centre III,1,1,-12,9,9,9.1
Bunyoro,Masindi District,Kyamaiso Health Centre II,1,1,,5,5,
Kigezi,Rukungiri District,Kyamakanda Health Centre II,1,1,-50,3,3,
Bunyoro,Kagadi District,Kyamasega Health Centre II,1,1,-19,125,125,-30
Tooro,Kasese District,Kyambogho Clinic,,,,,,
Tooro,Kasese District,Kyambogho SDA Clinic,1,1,,,,
Kampala,Kampala District,Kyambogo University Medical Centre,1,1,,,,
Ankole,Rubirizi District,Kyambura Medical Clinic,1,1,,,,
Ankole,Kazo District,Kyampangara Health Centre II,1,1,18,18,20,70.6
North Central,Mukono District,Kyampisi Health Centre III,1,1,27,41,48,21.1
Ankole,Bushenyi District,Kyamuhunga Health Centre III,1,1,-8,13,13,74.7
South Central,Kalungu District,Kyamulbwa Prisons Health Centre II,1,1,,,,
South Central,Kalungu District,Kyamulibwa Health Centre III,1,1,69,8,8,37.7
North Central,Mityana District,Kyamusisi Health Centre III,1,1,67,10,10,39
Ankole,Isingiro District,Kyamusoni Health Centre II,1,1,11,8,8,-30
South Central,Masaka City,Kyamuyimbwa Health Centre II,1,1,30,23,23,61.4
Ankole,Ntungamo District,Kyamwasha Health Centre III,1,1,-6,55,55,
Bukedi,Tororo District,Kyamwinula Health Centre II,1,1,0,14,14,4.7
Kigezi,Kabale District,Kyanamira Health Centre III,1,1,0,10,10,52.9
North Central,Kassanda District,Kyanamugera Health Centre II,1,1,8,33,33,4.3
South Central,Masaka District,Kyanamukaaka Health Centre IV,1,1,-12,85,85,-52.6
South Central,Masaka District,Kyanamukaaka Prisons Health Centre II,1,1,,,,
North Central,Kiboga District,Kyanamuyonjo Health Centre III,1,1,56,4,4,64
Busoga,Mayuge District,Kyando Health Centre II,1,1,-19,19,19,
North Central,Nakaseke District,Kyangato Health Centre II,1,1,-8,27,27,48
South Central,Kyotera District,Kyango Health Centre III,1,1,62,5,5,
Bunyoro,Kikuube District,Kyangwali Health Centre IV,1,1,10,142,152,
Bunyoro,Kikuube District,Kyangwali Prisons Health Centre II,1,1,,,,
Ankole,Sheema District,Kyangyenyi Health Centre III,1,1,3,36,36,22.1
Busoga,Kaliro District,Kyani Health Centre II,1,1,6,30,30,22.5
Kampala,Kampala District,Kyanja Community Health Centre,,,,,,
Kampala,Kampala District,Kyanja Medical Centre,,,,,,
South Central,Wakiso District,Kyanja Medical Clinic,,,,,,
Tooro,Kyenjojo District,Kyankaramata Health Centre III,1,1,39,33,33,28.9
North Central,Kyankwanzi District,Kyankwanzi Health Centre III,1,1,71,4,3,
North Central,Mityana District,Kyantungo Health Centre IV,1,1,-7,29,29,
Tooro,Kasese District,Kyanya SDA Health Centre II,1,1,-57,11,10,
Ankole,Isingiro District,Kyarugaju Health Centre III,1,1,12,15,15,8.9
Tooro,Kasese District,Kyarumba Health Centre III,1,1,67,1,27,92.7
Tooro,Kasese District,Kyarumba Phc Health Centre III,1,1,6,34,35,-68.3
Tooro,Kyenjojo District,Kyarusozi Health Centre IV,1,1,38,47,47,9.5
Ankole,Mbarara City,Kyarwabuganda Health Centre III,1,1,-17,27,17,-35.8
Kigezi,Kabale District,Kyasano Health Centre II,1,1,-43,10,10,26.7
North Central,Kassanda District,Kyasansuwa Health Centre III,1,1,-19,37,33,47.1
Bugisu,Namisindwa District,Kyaterekera Clinic,,,,,,
Bugisu,Namisindwa District,Kyaterekera Domiciliary Clinic,1,1,,,,
Bunyoro,Kagadi District,Kyaterekera Health Centre III,1,1,11,70,53,-22.6
Bunyoro,Masindi District,Kyatiri Health Centre III,1,1,49,29,29,-1.3
Bunyoro,Masindi District,Kyatiri Mary Mother of the Church Health Centre III,1,1,-25,50,50,
North Central,Kassanda District,Kyato Health Centre II,1,0,,,,
Kigezi,Rukungiri District,Kyatoko Health Centre II,1,1,0,3,3,
South Central,Gomba District,Kyayi Health Centre III,1,1,-5,23,23,-3.1
North Central,Kiboga District,Kyayimba Epi Health Centre II,1,1,11,17,17,8.6
South Central,Lwengo District,Kyazanga Health Centre IV,1,1,38,16,18,-143.3
South Central,Lwengo District,Kyazanga Prisons Health Centre II,1,1,,,,
South Central,Wakiso District,Kyebando Doctors Clinic,,,,,,
Kampala,Kampala District,Kyebando Doctors Medicla Centre,1,1,,,,
Bunyoro,Kibaale District,Kyebando Health Centre III,1,1,39,20,20,67.4
Kampala,Kampala District,Kyebando Health Clinic,1,1,,,,
South Central,Wakiso District,Kyebando Nursing Home Health Centre III,1,1,7,41,33,2.3
South Central,Kyotera District,Kyebe Health Centre III,1,1,-31,17,17,
South Central,Sembabule District,Kyeera Health Centre II,1,1,36,23,23,-18.8
Busoga,Kamuli District,Kyeeya Health Centre III,1,1,-112,55,55,0.91
Tooro,Kyegegwa District,Kyegegwa General Hospital,1,1,19,148,149,31.5
Tooro,Kyegegwa District,Kyegegwa Prisons Health Centre II,1,1,,,,
Bunyoro,Kikuube District,Kyehoro Health Centre III,1,1,15,17,17,70.2
Ankole,Sheema District,Kyeibanga Health Centre III,1,1,-36,30,30,11.1
Ankole,Mitooma District,Kyeibare Health Centre II,1,1,-23,16,16,16
Ankole,Kiruhura District,Kyeibuza (St. Marys) Health Centre III,1,1,-12,27,27,11.1
Ankole,Sheema District,Kyeihara Health Centre III,1,1,0,7,7,0
Ankole,Ibanda District,Kyeikucu Health Centre II,1,1,-100,6,6,-700
Ankole,Isingiro District,Kyeirumba Health Centre III,1,1,19,13,13,32.9
Ankole,Bushenyi District,Kyeizooba Farmers Clinic,1,0,,,,
Ankole,Bushenyi District,Kyeizooba Health Centre III,1,1,0,50,50,10.6
North Central,Kiboga District,Kyekumbya Health Centre II,1,1,-100,20,20,21.7
South Central,Lyantonde District,Kyemamba Health Centre II,1,1,-17,14,13,466.7
Tooro,Kyenjojo District,Kyembogo Holy Cross Health Centre III,1,1,27,78,78,11
Busoga,Bugiri District,Kyemeire Health Centre II,1,1,-14,8,8,
Tooro,Kasese District,Kyemihoko Health Centre II,1,1,,,,
Tooro,Kamwenge District,Kyempango Health Centre III,1,1,,,0,
Tooro,Kasese District,Kyempara Health Centre III,1,1,-33,20,10,-2
South Central,Rakai District,Kyempewo Health Centre II,1,1,17,5,3,
Tooro,Kitagwenda District,Kyendangara Medical Centre,,,,,,
Ankole,Kazo District,Kyengando Health Centre II,1,1,9,29,29,-28.6
South Central,Wakiso District,Kyengera Health Centre III,1,1,-7,152,131,-25.1
South Central,Wakiso District,Kyengera Nursing Home Clinic,,,,,,
South Central,Wakiso District,Kyengera Treatment Health Centre III,1,0,,,,
South Central,Wakiso District,Kyengeza Health Centre II,1,1,13,28,28,
Tooro,Kyenjojo District,Kyenjojo General Hospital,1,1,2,257,257,7.1
Tooro,Kyenjojo District,Kyenjojo Police Health Centre II,1,1,,,,
Tooro,Kyenjojo District,Kyenjojo Prisons Health Centre II,1,1,,,,
South Central,Lyantonde District,Kyenshama Health Centre II,1,1,42,7,7,
Kigezi,Rubanda District,Kyenyi Health Centre II,1,1,-36,53,53,-43
Ankole,Rubirizi District,Kyenzaza Health Centre III,1,1,75,6,6,
Teso,Serere District,Kyere Health Centre III,1,1,1,107,107,643.3
Teso,Serere District,Kyere Mission Health Centre III,1,1,-20,36,36,10.3
Kigezi,Rukiga District,Kyerero Health Centre II,1,1,-50,12,12,0
North Central,Kayunga District,Kyerima Parents Clinic,,,,,,
Bugisu,Sironko District,Kyesha Health Centre II,1,1,-14,24,24,-1050
Kigezi,Kanungu District,Kyeshero Health Centre II,1,1,-29,9,7,-5
North Central,Mukono District,Kyetume CBHC Health Centre IV,1,1,-29,27,29,71.2
South Central,Lwengo District,Kyetume Health Centre III,1,1,-10,32,32,170
North Central,Luwero District,Kyevunze Health Centre II,1,1,100,,,50
Ankole,Buhweju District,Kyeyare Health Centre II,1,1,-24,21,21,
North Central,Nakasongola District,Kyeyindula Health Centre II,1,1,-11,10,10,41.3
Ankole,Isingiro District,Kyezimbire Health Centre II,1,1,-21,17,17,
Kigezi,Kabale District,Kyobugombe Health Centre II,1,1,-25,15,15,
Busoga,Mayuge District,Kyoga Health Centre II,1,1,-138,62,62,
Kigezi,Rukiga District,Kyogo Health Centre III,1,1,-50,6,6,54.1
Busoga,Jinja City,Kyomya Health Centre II,1,1,-50,3,3,56.7
Tooro,Bundibugyo District,Kyondo (Bundibugyo) Health Centre III,1,1,24,16,16,28.6
Tooro,Kasese District,Kyondo Health Centre III,1,1,1,107,107,1.2
North Central,Kiboga District,Kyoomya Health Centre II,1,1,6,16,16,4.3
Kampala,Kampala District,Kyosiima Maternity and Nursing Home,1,1,-67,30,30,-9.9
South Central,Kyotera District,Kyotera Med. Health Centre III,1,1,-22,11,6,-23.8
